{
  "schema_version": "1",
  "tool_version": "0.2.0",
  "scanned_at": "2026-04-26T12:00:00Z",
  "source": "manual",
  "input": {
    "path": "logs/clean.log",
    "size_bytes": 512,
    "lines": 24
  },
  "findings": [],
  "summary": {
    "total": 0,
    "by_severity": {},
    "by_category": {}
  }
}
